<?xml version="1.0"?>
<!--

    Copyright (c) 2015 TerraFrame, Inc. All rights reserved.

    This file is part of Runway SDK GIS(tm).

    Runway SDK GIS(tm) is free software: you can redistribute it and/or modify
    it under the terms of the GNU Lesser General Public License as
    published by the Free Software Foundation, either version 3 of the
    License, or (at your option) any later version.

    Runway SDK GIS(tm) is distributed in the hope that it will be useful, but
    WITHOUT ANY WARRANTY; without even the implied warranty of
    MERCHANTABILITY or FITNESS FOR A PARTICULAR PURPOSE.  See the
    GNU Lesser General Public License for more details.

    You should have received a copy of the GNU Lesser General Public
    License along with Runway SDK GIS(tm).  If not, see <http://www.gnu.org/licenses/>.

-->
<xs:schema xmlns:xs="http://www.w3.org/2001/XMLSchema">

  <!--The root element of the xml schema-->
  <xs:element name="Instances">
    <xs:complexType>
      <xs:choice minOccurs="0" maxOccurs="unbounded">
        <xs:element ref="object"/>
        <xs:element ref="relationship"/>
      </xs:choice>
    </xs:complexType>
  </xs:element>

    <!--A particualr instance of a class dataObject-->
  <xs:element name="object">
    <xs:complexType>
      <xs:choice minOccurs="0" maxOccurs="unbounded">
        <!--The attribute-value pairings of the instance-->
        <xs:element ref="value"/>
        <!--The attribute-multi xml oid pairing of the instance-->
        <xs:element ref="enumeration"/>
        <!--The struct attribute values-->
        <xs:element ref="struct"/>
      </xs:choice>
      <!--A unqiue oid for the instance-->
      <xs:attribute name="oid" type="xs:string" use="required"/>
      <!--The qualified path of the class being instaniated-->
      <xs:attribute name="type" type="xs:string" use="required"/>
    </xs:complexType>
  </xs:element>

  <!--A particular instance of a Relationship object. A relationship cannot reference a standalone type-->
  <xs:element name="relationship">
    <xs:complexType>
      <xs:choice minOccurs="0" maxOccurs="unbounded">
        <!--The attribute-value pairings of the instance-->
        <xs:element ref="value"/>
        <!--The attribute-multi xml oid pairing of the instance-->
        <xs:element ref="enumeration"/>
        <!--The struct attribute values-->
        <xs:element ref="struct"/>
      </xs:choice>
      <!--A unqiue oid for the instance-->
      <xs:attribute name="oid" type="xs:string" use="required"/>
      <!--The qualified path of the class being instaniated-->
      <xs:attribute name="type" type="xs:string" use="required"/>
      <!--parentOid: The xml oid of the instance of the parent-->
      <xs:attribute name="parentOid" type="xs:string" use="required"/>
      <!--childOid: The xml oid of the instance of the child-->
      <xs:attribute name="childOid" type="xs:string" use="required"/>
    </xs:complexType>
  </xs:element>

  <!--Sets the value of an attribute for a particular instance-->
  <xs:element name="value">
    <xs:complexType>
      <xs:simpleContent>
        <!--value: The value for the attribute instantiated-->
        <xs:extension base="xs:string">
          <!--attribute: The name of the attribute instantiated-->
          <xs:attribute name="attribute" type="xs:string" use="required"/>
        </xs:extension>
      </xs:simpleContent>
    </xs:complexType>
  </xs:element>

  <!--Sets the value of an attribute which references multiple instances-->
  <xs:element name="enumeration">
    <xs:complexType>
      <xs:sequence>
        <xs:element name="value" minOccurs="0" maxOccurs="unbounded">
          <xs:complexType>
            <!--oid: The xml oid of the class being referenced-->
            <xs:attribute name="value" type="xs:string" use="required"/>
          </xs:complexType>
        </xs:element>
      </xs:sequence>
      <!--attribute: The name of attribute being instantiated-->
      <xs:attribute name="attribute" type="xs:string" use="required"/>
    </xs:complexType>
  </xs:element>

  <!--Use for instance of struct attributes, must reference standalone type-->
  <xs:element name="struct">
    <xs:complexType>
      <xs:choice minOccurs="0" maxOccurs="unbounded">
        <!--The attribute-value pairings of the instance-->
        <xs:element ref="value"/>
        <!--The attribute-multi xml oid pairing of the instance-->
        <xs:element ref="enumeration"/>
      </xs:choice>
      <!--attribute: The name of the struct attribute-->
      <xs:attribute name="attribute" type="xs:string" use="required"/>
      <!--attribute: The oid of the struct object-->
      <xs:attribute name="oid" type="xs:string" use="required"/>
    </xs:complexType>
  </xs:element>
</xs:schema>